{
  "id": "deck_structure",
  "type": "pptx_structure",
  "weight": 0.8,
  "threshold": 0.9,
  "required": true,
  "config": {
    "artifact_id": "deck",
    "min_slides": 5,
    "max_slides": 5,
    "min_charts": 1,
    "min_tables": 1,
    "min_non_empty_slides": 5,
    "required_keywords": ["sales", "region", "summary", "recommendation"],
    "max_text_chars_per_slide": 850,
    "require_widescreen": true
  }
}
