{
  "id": "training_structure",
  "type": "pptx_structure",
  "weight": 0.45,
  "threshold": 0.8,
  "required": true,
  "config": {
    "artifact_id": "deck",
    "min_slides": 12,
    "max_slides": 15,
    "min_speaker_notes_slides": 5,
    "required_keywords": ["objective", "example", "exercise", "answer", "checklist"],
    "max_text_chars_per_slide": 900,
    "require_widescreen": true
  }
}
