{
  "id": "sales_structure",
  "type": "pptx_structure",
  "weight": 0.45,
  "threshold": 0.78,
  "required": true,
  "config": {
    "artifact_id": "deck",
    "min_slides": 9,
    "max_slides": 11,
    "min_images": 2,
    "min_tables": 1,
    "min_non_empty_slides": 9,
    "required_keywords": ["CISO", "risk", "architecture", "differentiator", "compliance", "ROI", "implementation", "next steps"],
    "max_text_chars_per_slide": 850,
    "require_widescreen": true
  }
}
