{
  "id": "defense_structure",
  "type": "pptx_structure",
  "weight": 0.45,
  "threshold": 0.8,
  "required": true,
  "config": {
    "artifact_id": "deck",
    "min_slides": 12,
    "max_slides": 14,
    "min_charts": 2,
    "min_tables": 1,
    "min_non_empty_slides": 12,
    "required_keywords": ["research question", "hypothesis", "method", "participant", "result", "limitation", "contribution", "future work"],
    "max_text_chars_per_slide": 900,
    "require_widescreen": true
  }
}
