{
  "id": "deck_structure",
  "type": "pptx_structure",
  "weight": 0.35,
  "threshold": 0.8,
  "required": true,
  "config": {
    "artifact_id": "deck",
    "min_slides": 10,
    "max_slides": 12,
    "min_charts": 2,
    "min_tables": 1,
    "min_non_empty_slides": 10,
    "required_keywords": ["QBR", "growth", "retention", "funnel", "recommendation"],
    "max_text_chars_per_slide": 950,
    "require_widescreen": true
  }
}
