{
  "id": "rework_workflow",
  "type": "trace_signal",
  "weight": 0.15,
  "threshold": 0.5,
  "required": false,
  "config": {
    "signals": [
      { "id": "preserved_message", "any_text": ["outline", "message", "preserve", "original"], "min_count": 2 },
      { "id": "planned_design", "any_text": ["brand", "visual", "hierarchy", "roadmap"], "min_count": 2 },
      { "id": "checked_polish", "any_text": ["review", "check", "preview", "quality"], "min_count": 1 }
    ]
  }
}
