{
  "id": "rework_structure",
  "type": "pptx_structure",
  "weight": 0.45,
  "threshold": 0.78,
  "required": true,
  "config": {
    "artifact_id": "deck",
    "min_slides": 8,
    "max_slides": 10,
    "min_images": 2,
    "min_tables": 1,
    "min_non_empty_slides": 8,
    "required_keywords": ["activation", "onboarding", "cash-flow", "alerts", "integration", "roadmap", "metrics", "appendix"],
    "max_text_chars_per_slide": 750,
    "require_widescreen": true
  }
}
