{
  "id": "policy_structure",
  "type": "pptx_structure",
  "weight": 0.4,
  "threshold": 0.78,
  "required": true,
  "config": {
    "artifact_id": "deck",
    "min_slides": 10,
    "max_slides": 12,
    "min_charts": 1,
    "min_tables": 1,
    "min_non_empty_slides": 10,
    "required_keywords": ["policy goal", "congestion", "peer", "options", "equity", "risk", "roadmap", "metrics", "recommendation"],
    "max_text_chars_per_slide": 900,
    "require_widescreen": true
  }
}
